{
  "$schema": "https://json-schema.org/draft/2020-12/schema",
  "$id": "https://example.invalid/mnel/schemas/mnel-recurrent-specialist.schema.json",
  "title": "MNEL bounded recurrent specialist artifact",
  "type": "object",
  "additionalProperties": false,
  "required": ["schema", "provider_id", "provider_abi", "target_role", "generation_identity", "architecture_identity", "training_code_identity", "training_dataset_identity", "training_spec_identity", "checkpoint_identity", "calibration_identity", "operating_envelope", "class_centroids", "training_record_ids", "source_evidence_references", "authority", "model_identity", "artifact_identity"],
  "properties": {
    "schema": {"const": "mnel-recurrent-specialist-artifact/0.1"},
    "provider_id": {"type": "string", "minLength": 1},
    "provider_abi": {"const": "mnel-specialist-provider-abi/0.1"},
    "target_role": {"type": "string", "minLength": 1},
    "architecture": {"type": "object"},
    "generation_identity": {"$ref": "#/$defs/identity"},
    "architecture_identity": {"$ref": "#/$defs/identity"},
    "training_code_identity": {"$ref": "#/$defs/identity"},
    "training_dataset_identity": {"$ref": "#/$defs/identity"},
    "training_spec_identity": {"$ref": "#/$defs/identity"},
    "checkpoint_identity": {"$ref": "#/$defs/identity"},
    "calibration_identity": {"$ref": "#/$defs/identity"},
    "operating_envelope": {"type": "object", "required": ["max_iterations", "minimum_confidence", "maximum_distance", "convergence_delta", "maximum_context_observations", "maximum_query_abs", "envelope_identity"]},
    "class_centroids": {"type": "object", "minProperties": 1, "additionalProperties": {"type": "array", "minItems": 4, "maxItems": 4, "items": {"type": "integer"}}},
    "training_record_ids": {"type": "array", "minItems": 1, "items": {"type": "string", "minLength": 1}},
    "source_evidence_references": {"type": "array", "items": {"type": "string", "minLength": 1}},
    "parent_model_identity": {"anyOf": [{"$ref": "#/$defs/identity"}, {"type": "null"}]},
    "negative_memory": {"type": "array", "items": {"type": "string"}},
    "inherited_strategies": {"type": "array", "items": {"type": "string"}},
    "known_counterexamples": {"type": "array", "items": {"type": "string"}},
    "prior_failure_causes": {"type": "array", "items": {"type": "string"}},
    "authority": {"const": "diagnostic-only"},
    "semantics": {"type": "string", "minLength": 1},
    "model_identity": {"$ref": "#/$defs/identity"},
    "artifact_identity": {"$ref": "#/$defs/identity"}
  },
  "$defs": {"identity": {"type": "string", "pattern": "^sha256:[0-9a-f]{64}$"}}
}
