{"architecture":{"context_state":"persistent-derived-summary","kind":"bounded-recurrent-centroid","masked_select":true,"max_iterations":4,"reasoning_state":"per-query-fixed-point-lanes","width":4},"architecture_identity":"sha256:0b854e10e4fc3843017c7a264620bcfb2ace844ade15820e313e2a0faf737ab4","artifact_identity":"sha256:f85a6a6128e04a793e4dbf62251053c531ea8ee7e1228b84e4c5a1c462902338","authority":"diagnostic-only","calibration_identity":"sha256:ed45dd8137189986ff154df38594c3ee8f92fcde2db18c3c159db1ebd9e7740b","checkpoint_identity":"sha256:7411beef4eab8ac1d6d0c86c7fe9ec5f2e139b22b38aa67d39beda3ca1051d82","class_centroids":{"filesystem":[900,800,700,200],"forge":[600,500,800,850],"git":[800,700,220,400],"testing":[700,820,600,700]},"generation_identity":"sha256:8056daf8a283b378999995dc96f53cb03b3bea3440adcc279bfab1cf79b2ac27","inherited_strategies":[],"known_counterexamples":[],"model_identity":"sha256:d605a9ee3bf59ad31eac8d712d94a244decbd7455cf176fa70b0054ecebce44a","negative_memory":["destructive-tool-never-authorized"],"operating_envelope":{"convergence_delta":2,"envelope_identity":"sha256:9a6a22dbdc10856fc7e480810f8e2912b59d1bb8be15b8b0082a68fffd942bbd","max_iterations":4,"maximum_context_observations":32,"maximum_distance":180,"maximum_query_abs":1000,"minimum_confidence":850},"parent_model_identity":null,"prior_failure_causes":[],"provider_abi":"mnel-specialist-provider-abi/0.1","provider_id":"mnel-bounded-recurrent-specialist/0.1","schema":"mnel-recurrent-specialist-artifact/0.1","semantics":"identity-bound-learned-specialist; diagnostic-only; not-a-verdict","source_evidence_references":["control-train-files","control-train-forge","control-train-git","control-train-tests"],"target_role":"control.tool-family-routing","training_code_identity":"sha256:cead54014d62e920af40844af0c6556ea9ae7cde2b32bee77dcde0695c9b6d2c","training_dataset_identity":"sha256:1e41109b307452405f2b97082ead6e9604f6841636e37a255d9cba1cb5df5e76","training_record_ids":["control-train-files","control-train-forge","control-train-git","control-train-tests"],"training_spec_identity":"sha256:fbe653836dcaa301da274b9fc1d8d203ea4ca67dff9426510054aa73d57921f9"}