{"architecture":{"context_state":"persistent-derived-summary","kind":"bounded-recurrent-centroid","masked_select":true,"max_iterations":4,"reasoning_state":"per-query-fixed-point-lanes","width":4},"architecture_identity":"sha256:0b854e10e4fc3843017c7a264620bcfb2ace844ade15820e313e2a0faf737ab4","artifact_identity":"sha256:c0a860ad60b33a3cc6d77b55bf6bc5f5fc711232d0b31ca34adcaf2c7c6b3ce2","authority":"diagnostic-only","calibration_identity":"sha256:3a9c61b28bc33a51e5ae1ac50029830d48b8d310c6a539fc874e378ab6540d05","checkpoint_identity":"sha256:92a9795d8d45d9dd1146efcfc1efff9da98524422f194a077c5ad08ccb027c1b","class_centroids":{"irrelevant":[170,150,170,130],"relevant":[860,790,730,840]},"generation_identity":"sha256:2767857f27a108bee26d88acb05597c2233500dd81e69c89ac621d423c4917d4","inherited_strategies":[],"known_counterexamples":[],"model_identity":"sha256:b3c8ba2bd9672b2ea652a92d1fd81c4c2f15db76c59a4ee5ff5fb90b72d94f62","negative_memory":["known-omission-is-escalation"],"operating_envelope":{"convergence_delta":2,"envelope_identity":"sha256:7a7248d840ac9b048935ebdb6b34e5188526f4dea78d850357ed122d18d78a7e","max_iterations":4,"maximum_context_observations":32,"maximum_distance":460,"maximum_query_abs":1000,"minimum_confidence":850},"parent_model_identity":null,"prior_failure_causes":[],"provider_abi":"mnel-specialist-provider-abi/0.1","provider_id":"mnel-bounded-recurrent-specialist/0.1","schema":"mnel-recurrent-specialist-artifact/0.1","semantics":"identity-bound-learned-specialist; diagnostic-only; not-a-verdict","source_evidence_references":["forge-train-irrelevant-1","forge-train-irrelevant-2","forge-train-relevant-1","forge-train-relevant-2"],"target_role":"forge.evidence-relevance","training_code_identity":"sha256:cead54014d62e920af40844af0c6556ea9ae7cde2b32bee77dcde0695c9b6d2c","training_dataset_identity":"sha256:1cec040071b9fb21036bcf75403b17766d14094a4418e4c5835fd29e82140c3e","training_record_ids":["forge-train-irrelevant-1","forge-train-irrelevant-2","forge-train-relevant-1","forge-train-relevant-2"],"training_spec_identity":"sha256:c9d1736ae21cc36285aaecc34b41f656bfc2edab61e99b0a59c93ea37db525ba"}